number,keywords
1,leader pioneer independent original new beginnings
2,cooperation partnership balance diplomacy peace harmony
3,creativity expression joy social communication art
4,stability structure work discipline foundation order
5,freedom change adventure travel versatility
6,love responsibility family nurturing harmony home
7,analysis spirituality introspection wisdom seeker
8,power success authority ambition material wealth
9,completion humanitarian compassion forgiveness wisdom
10,invention leadership initiative new cycles
11,inspiration intuition illumination spiritual insight
12,creativity sacrifice transformation artistic
13,transformation rebirth change upheaval rebuilding
14,adventure freedom adaptability exploration
15,enchantment magnetism charisma love alchemy
16,tower upheaval awakening sudden change
17,hope immortality star inspiration guidance
18,illusion fear subconscious dreams intuition
19,sun success vitality joy enlightenment
20,judgment renewal awakening rebirth evaluation
21,universe completion success fulfillment world
22,master builder visionary idealism manifestation
23,royal star of the lion success charisma
24,protected blessed love harmony assistance
25,regeneration transformation wisdom discernment
26,partnership love cooperation rewards
27,command leadership authority wisdom
28,leadership independence wealth challenges
29,mastery spiritual power charisma vision
30,creativity joy communication fame
31,leadership ambition energy vitality
32,communication transformation mystic
33,master teacher compassion sacrifice christ consciousness
1,leader pioneer independent original new beginnings assertive courageous confident ambitious self-reliant trailblazer initiator yang energy aries
2,cooperation partnership balance diplomacy peace harmony sensitive gentle patient duality moon energy cancer mediator peacemaker
3,creativity expression joy social communication art optimism playful charisma self-expression jupiter energy gemini performer entertainer
4,stability structure work discipline foundation order practical builder security hard-working saturn energy taurus architect
5,freedom change adventure travel versatility sensual risk-taker progressive mercury energy curious adaptable restless
6,love responsibility family nurturing harmony home healing venus energy caring teacher counselor protector
7,analysis spirituality introspection wisdom seeker truth mystic philosopher solitude neptune energy researcher sage
8,power success authority ambition material wealth executive leadership karma saturn energy business magnate achiever
9,completion humanitarian compassion forgiveness wisdom universal love completion mars energy selfless philanthropist healer
10,invention leadership initiative new cycles instant manifestation wheel of fortune clean slate
11,inspiration intuition illumination spiritual insight master number visionary psychic portal high vibration
12,creativity sacrifice transformation artistic sensitivity martyr energy imaginative dreamer
13,transformation rebirth change upheaval rebuilding phoenix energy master builder through crisis
14,adventure freedom adaptability exploration five senses grounded change moderation temperance
15,enchantment magnetism charisma love alchemy transformation through love devil energy seduction
16,tower upheaval awakening sudden change ego death liberation lightning strike
17,hope immortality star inspiration guidance faith inner light aquarius energy
18,illusion fear subconscious dreams intuition moon energy hidden truths
19,sun success vitality joy enlightenment recognition ego integration
20,judgment renewal awakening rebirth evaluation resurrection higher calling
21,universe completion success fulfillment world mastery crown chakra
22,master builder visionary idealism manifestation architect of the future 11+11
23,royal star of the lion success charisma luck protection regal energy
24,protected blessed love harmony assistance venus+jupiter energy
25,regeneration transformation wisdom discernment introspection solitude strength
26,partnership love cooperation rewards business with heart healing through relationships
27,command leadership authority wisdom teacher of teachers spiritual authority
28,leadership independence wealth challenges tests of power saturn trials
29,mastery spiritual power charisma vision 11+18 high manifestation
30,creativity joy communication fame spotlight performer entertainer
31,leadership ambition energy vitality creator force pioneer
32,communication transformation mystic spiritual messenger high intuition
33,master teacher compassion sacrifice christ consciousness ultimate healer enlightenment